index,author,tweet,label,polarity,nouns
1,@recordeli,Recordeli get stocked「Our Man In Paris」by Dexter Gordon ▶︎,Neutral,0.0,['recordeli', 'stocked「our man', 'paris」by dexter gordon']
2,@WoodardHortense,Paris 4/20 Attack Hoax Caused by Alex Jones--Lies Lies Lies! NWO Secret ... via,Negative,-0.4,['attack hoax caused', 'alex jones', 'lies lies lies', 'nwo', 'secret ...']
3,@Kaide_Walsh,What occurs in France will ripple across the Atlantic. History repeats itself... The Barbarians are at t…,Neutral,0.0,['france', 'atlantic', 'history', 'barbarians']
4,@parvenbd,.@dailystarnews IS claims Paris attack!!,Neutral,0.0,['@ dailystarnews', 'is', 'paris']
5,@LisettePylant,The police officer killed in the Paris attack was a proud defender of gay rights,Positive,0.33888888888888896,['police officer', 'paris', 'proud defender', 'gay rights']
6,@tubenewsen,Trump: Paris terror attack will impact French election NEWS &gt&gt,Neutral,0.0,['trump', 'paris', 'terror attack', 'french election', 'news']
7,@Rakelmarkos,The police officer killed in the Paris attack was a proud defender of gay rights,Positive,0.33888888888888896,['police officer', 'paris', 'proud defender', 'gay rights']
8,@KNHops,Britain First leader posts blatant fake news gets caught out immediately,Negative,-0.25,['britain', 'leader posts blatant fake news']
9,@janendg2016,Just got back from Paris- constantly felt I needed to look over my shoulder seedy people ever…,Neutral,0.0,['paris-', 'shoulder seedy people ever…']
10,@kevmarmol,How can Twitter tick an account which tweets out a cricket win as celebrating Paris attack'? Ban Fake news,Positive,0.15000000000000002,['twitter', 'paris', 'ban fake']
11,@Goaliemom3533,How' that Open Borders/Multiculturalism Utopia working out for,Neutral,0.0,['borders/multiculturalism utopia']
12,@EJ_Atwood,Another terrorist attack in Paris. The people of France will not take much more of this. Will have a big effect on pre…,Positive,0.25,['terrorist attack', 'paris', 'france', 'will', 'big effect']
13,@Carlanun,The police officer killed in the Paris attack was a proud defender of gay rights,Positive,0.33888888888888896,['police officer', 'paris', 'proud defender', 'gay rights']
14,@PeaceAlwaysWork,The police officer killed in the Paris attack was a proud defender of gay rights,Positive,0.33888888888888896,['police officer', 'paris', 'proud defender', 'gay rights']
15,@EnagniD,Sections of Paris on lockdown after pre-election shooting,Neutral,0.0,['sections', 'paris', 'pre-election shooting']
16,@glangendorf01,Paris tweet is direct attempt 2 influence French election's outcome toward anti-EU Marine Le Pen. Working han…,Positive,0.05,['direct attempt', "french election 's outcome", 'anti-eu marine', 'pen', 'working']
17,@blueberry0455,Theo Graham wearing a Christian Dior gown Paris 1949 photo by Richard Avedon for Harper’s Bazaar,Neutral,0.0,['theo graham', 'dior', 'paris', 'richard avedon', 'harper’s bazaar']
18,@Jeb10307576,🆘‼️👮🔥 Netherlands: police stop a machete wielding attacker (shouting Allahu Akbar) with several shots in The Hague. Unno…,Neutral,0.0,['netherlands', 'allahu akbar', 'hague', 'unno…']
19,@ralphhallLvr,Paris terrorist attacked already getting blamed on white people.,Neutral,0.0,['white people']
20,@zflip26,Another terrorist attack in Paris. The people of France will not take much more of this. Will have a big effect on pre…,Positive,0.25,['terrorist attack', 'paris', 'france', 'will', 'big effect']
21,@mephistofish,2 female tourists are assaulted by Muslim migrants under the Eiffel Tower. The city of lights has gone dark. htt…,Negative,-0.075,['female tourists', 'muslim', 'eiffel tower']
22,@RickyDa45643274,Media scolds Trump for referring to Paris terror attack as a terror attack.,Neutral,0.0,['media', 'trump', 'paris', 'terror attack', 'terror attack']
23,@mendcommunity,How can Twitter tick an account which tweets out a cricket win as celebrating Paris attack'? Ban Fake news,Positive,0.15000000000000002,['twitter', 'paris', 'ban fake']
24,@derry3,Paul I am a Kipperbut how is this proof that they are celebrating the Paris terror attacks? You do yourself no cre…,Neutral,0.0,['paul', 'kipperbut', 'paris', 'terror attacks']
25,@GatorMama44,The police officer killed in the Paris attack was a proud defender of gay rights,Positive,0.33888888888888896,['police officer', 'paris', 'proud defender', 'gay rights']
26,@audibleakbar,How can Twitter tick an account which tweets out a cricket win as celebrating Paris attack'? Ban Fake news,Positive,0.15000000000000002,['twitter', 'paris', 'ban fake']
27,@PrincessofWails,Either Marine Le Pen wins this election or we make the "Pray for Paris" profile filter permanent.Your choice France.…,Positive,0.3,['either', 'pen', 'pray', 'paris', 'profile filter permanent.your choice', 'france.…']
28,@Hapjamlaw,The police officer killed in the Paris attack was a proud defender of gay rights,Positive,0.33888888888888896,['police officer', 'paris', 'proud defender', 'gay rights']
29,@SamanthaAxelson,4/ Next Clint Eastwood movie will feature an Oregon hero's story in stopping Paris train terror,Neutral,0.0,['clint eastwood', 'oregon', "hero 's story", 'paris', 'train terror']
30,@tiago_yola,Another terrorist attack in Paris. The people of France will not take much more of this. Will have a big effect on pre…,Positive,0.25,['terrorist attack', 'paris', 'france', 'will', 'big effect']
31,@AudiodjPuls,Dedicated to Michael's children are greatPRINCE PARIS AND BLANKET.,Neutral,0.0,['dedicated', 'michael', "'s children", 'paris and blanket']
32,@RABBITISH1,The police officer killed in the Paris attack was a proud defender of gay rights,Positive,0.33888888888888896,['police officer', 'paris', 'proud defender', 'gay rights']
33,@wildcard40001,Another terrorist attack in Paris. The people of France will not take much more of this. Will have a big effect on pre…,Positive,0.25,['terrorist attack', 'paris', 'france', 'will', 'big effect']
34,@91springer,Media Won't Show you Paris at War!Muslim "Refugee" Gangs attack Police  Locals 👉🏻Media remains silent as the invasion contin…,Neutral,0.0,['media wo', 'paris', 'muslim', 'refugee', 'gangs', 'locals', 'invasion contin…']
35,@horokhova,Best moment in Paris?Best moment of my life!,Positive,1.0,['paris']
36,@JamesTorres96,Another terrorist attack in Paris. The people of France will not take much more of this. Will have a big effect on pre…,Positive,0.25,['terrorist attack', 'paris', 'france', 'will', 'big effect']
37,@ParrotRico,Another terrorist attack in Paris. The people of France will not take much more of this. Will have a big effect on pre…,Positive,0.25,['terrorist attack', 'paris', 'france', 'will', 'big effect']
38,@62y0NZzmTsglEwR,hilton naked tits mature sex swingers,Positive,0.05,['mature sex swingers']
39,@FctHerve,Now more than ever.#ParisAttack htt…,Positive,0.5,['ever. #', 'parisattack']
40,@AlexBrookLynn,Today's ISIS terror attack in Paris might just put the far right's Marine Le Pen in power,Positive,0.19285714285714284,['isis', 'terror attack', 'paris', "'s marine", 'pen']
41,@Mar2vin,Another terrorist attack in Paris. The people of France will not take much more of this. Will have a big effect on pre…,Positive,0.25,['terrorist attack', 'paris', 'france', 'will', 'big effect']
42,@Trumpocrat17,Another terrorist attack in Paris. The people of France will not take much more of this. Will have a big effect on pre…,Positive,0.25,['terrorist attack', 'paris', 'france', 'will', 'big effect']
43,@MDavidMorris2,Marine Le Pen Post-Paris Terror Vows to Voters to Restore France Borders,Neutral,0.0,['pen post-paris', 'vows', 'restore france borders']
44,@nikkirojo4life,The police officer killed in the Paris attack was a proud defender of gay rights,Positive,0.33888888888888896,['police officer', 'paris', 'proud defender', 'gay rights']
45,@Clive_A_Boyce,BBC News - Clint Eastwood directs Paris train terror film,Neutral,0.0,['bbc', 'clint eastwood', 'paris', 'train terror film']
46,@MurielleBaron,The police officer killed in the Paris attack was a proud defender of gay rights,Positive,0.33888888888888896,['police officer', 'paris', 'proud defender', 'gay rights']
47,@aark1954,Another terrorist attack in Paris. The people of France will not take much more of this. Will have a big effect on pre…,Positive,0.25,['terrorist attack', 'paris', 'france', 'will', 'big effect']
48,@zvezda_int,Paris attack aimed at destabilising country in its 'decisive hours' - Macron,Neutral,0.0,["'decisive hours", 'macron']
49,@OsborneInk,Britain First leader posts blatant fake news gets caught out immediately,Negative,-0.25,['britain', 'leader posts blatant fake news']
50,@BibleApocalypse,EU vice president calls for diversity... a few hours before Paris terror attack.,Negative,-0.2,['eu', 'vice president calls', 'diversity ...', 'paris', 'terror attack']
51,@billpostmus,BREAKING: Written note defending ISIS found next to body of gunman French judicial source says.,Neutral,0.0,['breaking', 'written', 'isis', 'french judicial source']
52,@JSPartisan,The police officer killed in the Paris attack was a proud defender of gay rights,Positive,0.33888888888888896,['police officer', 'paris', 'proud defender', 'gay rights']
53,@kallaber,Paris Terror: AP Humiliated AGAIN With Trump 'Fact Check' (Bonus: NBC News Appearance!),Neutral,0.0,['humiliated again', 'trump', 'bonus', 'nbc news', 'appearance']
54,@mikeymahon35,Oh look a crowd of 'moderate' Muslims celebrating the Paris terror attack in London.,Neutral,0.0,['oh', 'muslims', 'paris', 'terror attack', 'london']
55,@thegoodamerikan,The police officer killed in the Paris attack was a proud defender of gay rights,Positive,0.33888888888888896,['police officer', 'paris', 'proud defender', 'gay rights']
56,@KaewKosa12,1 police officer killed 2 others severely injured in shooting attack on Champs Elysees in Paris gunman killed by police,Negative,-0.2,['police officer', 'champs elysees', 'paris']
57,@sudeepkhatri,Another terrorist attack in Paris. The people of France will not take much more of this. Will have a big effect on pre…,Positive,0.25,['terrorist attack', 'paris', 'france', 'will', 'big effect']
58,@Chafoua,The police officer killed in the Paris attack was a proud defender of gay rights,Positive,0.33888888888888896,['police officer', 'paris', 'proud defender', 'gay rights']
59,@MurphyLillian,DRAMATIC VIDEO: Paris Jihadi Who Killed Police Officer Was Released Early From 20 yr Jail Sentence,Negative,-0.15833333333333333,['dramatic video', 'paris jihadi who killed', 'was released early', 'yr jail', 'sentence']
60,@neil45534840,We learn today that the Paris policeman shot by terrorist was Gay. Talk about killing two birds with one stone.,Positive,0.4166666666666667,['paris', 'policeman shot', 'gay', 'talk']
61,@DianeDallas10,Look what EU globalist open borders did to Paris. They must be so proud.,Positive,0.4,['eu', 'paris']
62,@Fantomax94,France please vote for Marine Le Pen or you will see more of this.,Positive,0.5,['france', 'pen']
63,@ingrasam,The police officer killed in the Paris attack was a proud defender of gay rights,Positive,0.33888888888888896,['police officer', 'paris', 'proud defender', 'gay rights']
64,@anth8541,Another terrorist attack in Paris. The people of France will not take much more of this. Will have a big effect on pre…,Positive,0.25,['terrorist attack', 'paris', 'france', 'will', 'big effect']
65,@bertadesherlia,Multiple Antifa accounts celebrating Paris terror attacks on open comms,Neutral,0.0,['multiple antifa', 'paris', 'terror attacks', 'open comms']
66,@Amethystca,Marine Le Pen has called for the immediate reinstatement of border checks in response to the Paris shooting.,Neutral,0.0,['pen', 'immediate reinstatement', 'border checks', 'paris']
67,@stephaniewads10,Last year Muslims murdered more people in France than were killed by terrorism in the country during the entire 20th century…,Positive,0.06,['muslims', 'france', 'entire 20th century…']
68,@AndyWoodward85,The UK strongly condemns the appalling terrorist attack in Paris. The Prime Minister has passed on her condolences to Pres…,Positive,0.04166666666666666,['uk', 'terrorist attack', 'paris', 'prime', 'pres…']
69,@NantucketDSA,Obama ended up apologizing for not joining solidarity march post-Charlie Hebdo. Trump openly boosts politicization of Pari…,Neutral,0.0,['obama', 'solidarity march post-charlie', 'hebdo', 'trump', 'boosts politicization', 'pari…']
70,@levelscafe,Off to or au weekend? No? Don't worry. You can still yak in and with us tomo…,Neutral,0.0,['off', 'au weekend']
71,@tstevensradio,Another terrorist attack in Paris. The people of France will not take much more of this. Will have a big effect on pre…,Positive,0.25,['terrorist attack', 'paris', 'france', 'will', 'big effect']
72,@AntiLeftistsFas,Paris: Muslim in Champs Elysees attack was known terrorist prior arrest for attacks on police,Negative,-0.025,['muslim', 'champs elysees']
73,@nds1776,No. French people should not have to live under the threat of being massacred because of your submission to Islamism,Positive,0.06818181818181818,['french people', 'islamism']
74,@Joseph1379,Terrorists Open Fire on Police on Paris’s Champs Elysees One Officer DEAD via,Negative,-0.1,['terrorists', 'open fire', 'paris’s champs elysees', 'dead']
75,@leftylabourtech,Compared to Toronto where fare increases are the norm Paris deliberately undercharges on fares to attract ridership. Imagin…,Neutral,0.0,['compared', 'toronto', 'fare increases', 'paris', 'imagin…']
76,@DaveNelsonn,ISIS-claimedWhen is political correctness going to claim responsibility?#tcot,Neutral,0.0,['isis-claimedwhen', 'political correctness', 'claim responsibility', '# tcot']
77,@RobertCitizen,Don't just pray for Paris. VOTE. #Paris,Neutral,0.0,['paris', 'vote', 'paris']
78,@Trumpocrat17,Paris is no longer safe – it's a War Zone!Illegal Muslim Invaders have made the streets of Paris their homes  toilets...#C…,Positive,0.5,['safe –', 'war zone', 'illegal muslim invaders', 'paris', 'homes toilets ... #', 'c…']
79,@tcgnome,As Paris Hilton would say "That was so NOT hot!" 😵,Negative,-0.15625,['paris hilton', 'not']
80,@FunPartyEtsyNYC,Bridal Shower I Love You Game in Paris theme:,Positive,0.04999999999999999,['bridal shower', 'love', 'game', 'paris']
81,@CampbellJamee,claims responsibility for the Paris terrorist attack. Just another peaceful Muslim. Nothing to see here…,Positive,0.25,['claims responsibility', 'paris', 'terrorist attack', 'muslim']
82,@BiswasRanit,The gunman who killed a police officer and wounded two people on the Champs-Elysees was arrested in February.,Negative,-0.2,['police officer', 'champs-elysees', 'february']
83,@thekrazykobra,Church of Saint-Vincent-de-Paul near Gare du Nord in,Positive,0.1,['saint-vincent-de-paul', 'gare', 'nord']
84,@Carreyland,Best moment in Paris?Best moment of my life!,Positive,1.0,['paris']
85,@lightdreamer365,Better get used t it says Macron,Positive,0.5,['macron']
86,@MONBEAUBETON,everywhere,Neutral,0.0,[]
87,@TravelGenieReg,Jet Airways Introduces Chennai-Paris Bengaluru-Amsterdam Flights,Neutral,0.0,['jet airways introduces chennai-paris bengaluru-amsterdam flights']
88,@Darahaeyoung,Koreans are calling Yoochun’s girlfriend the "Korean Paris Hilton" via,Neutral,0.0,['koreans', 'yoochun’s', 'korean paris hilton']
89,@stevano_b,First picture of ISIS terrorist who shot policeman dead in Paris Reallythey had all that on him?amazed!,Neutral,0.0,['isis', 'shot policeman', 'paris reallythey']
90,@dieb1948,ISIS claims deadly attack.,Negative,-0.2,['isis']
91,@FaheemBaig0077,Belgian federal prosecutor's office denies any link between in ht…,Neutral,0.0,["belgian federal prosecutor 's office denies"]
92,@its_sopherzzzz,Ok Paris Hilton has some cute ass dogs,Positive,0.5,['ok paris hilton', 'cute ass dogs']
93,@southernkimmy,France Identifies 39-Year-Old Suspected Islamist Who Had Shot Officers Before as Paris Attacker - Breitbart News,Neutral,0.0,['france identifies', 'suspected islamist who', 'shot officers', 'paris attacker', 'breitbart']
94,@Bukasinworld,Another terrorist attack in Paris. The people of France will not take much more of this. Will have a big effect on pre…,Positive,0.25,['terrorist attack', 'paris', 'france', 'will', 'big effect']
95,@gailg523,Gosh Megan it's SO GOOD to hear from you. Your Paris pics were great. Can't believe how bi…,Positive,0.75,['gosh megan', 'so good', 'your paris', 'ca']
96,@USPatriot01810,Blog: Will the Paris terror attack impact the French presidential election?,Neutral,0.0,['blog', 'will', 'paris', 'terror attack impact', 'french presidential election']
97,@deyoout,Another terrorist attack in Paris. The people of France will not take much more of this. Will have a big effect on pre…,Positive,0.25,['terrorist attack', 'paris', 'france', 'will', 'big effect']
98,@BetteGaeDart,This lying thieving socialist coward! THIS MAN is the reason that Paris is bleeding. We will have Le Pen!#ChampsElyse…,Neutral,0.0,['socialist coward', 'this man', 'paris', 'pen', 'champselyse…']
99,@roomeezon,Give the speech in Teheran traitor!#Paris Russia,Neutral,0.0,['teheran', 'paris russia']
100,@sufyq,How can Twitter tick an account which tweets out a cricket win as celebrating Paris attack'? Ban Fake news,Positive,0.15000000000000002,['twitter', 'paris', 'ban fake']
